{"schemaVersion":"1.0","eventId":"a1b2c3d4-0000-4000-8000-000000000018","time":"2026-11-02T09:18:00Z","sessionId":"7c9e6679-7425-40de-944b-e07fc1f90ae7","moduleId":"intro-chat","moduleVersion":"1.0.0","taskId":null,"source":"student","skills":["brief-writing"],"type":"mode_changed","data":{"from":"coach","to":"show-me"}}
