{"schemaVersion":"1.0","eventId":"a1b2c3d4-0000-4000-8000-000000000002","time":"2026-11-02T09:02:00Z","sessionId":"7c9e6679-7425-40de-944b-e07fc1f90ae7","moduleId":"intro-chat","moduleVersion":"1.0.0","taskId":"write-brief","source":"app","skills":["brief-writing"],"type":"attempt_submitted","data":{"attemptId":"a1b2c3d4-0000-4000-8000-000000000101","artifactDigest":"6db8fe2a3bb51d28a50887ede9f9a3bd550f35002d1409259bf3eb155129834d","artifactBytes":1}}
