{"schemaVersion":"1.0","eventId":"a1b2c3d4-0000-4000-8000-000000000025","time":"2026-11-02T09:00:00.123456+05:30","sessionId":"7c9e6679-7425-40de-944b-e07fc1f90ae7","moduleId":"intro-chat","moduleVersion":"1.0.0","taskId":"write-brief","source":"app","skills":["brief-writing"],"type":"task_opened","data":{}}
