{"schemaVersion":"1.0","eventId":"a1b2c3d4-0000-4000-8000-000000000005","time":"2026-11-02T09:05:00Z","sessionId":"7c9e6679-7425-40de-944b-e07fc1f90ae7","moduleId":"intro-chat","moduleVersion":"1.0.0","taskId":"write-brief","source":"app","skills":["brief-writing"],"type":"check_result","data":{"checkId":"brief-has-title","attemptId":"attempt-1","status":"passed","durationMs":420,"evidence":"The page has one heading.","runnerType":"script"}}
