{"schemaVersion":"1.0","eventId":"a1b2c3d4-0000-4000-8000-000000000015","time":"2026-11-02T09:15:00Z","sessionId":"7c9e6679-7425-40de-944b-e07fc1f90ae7","moduleId":"intro-chat","moduleVersion":"1.0.0","taskId":"write-brief","source":"app","skills":["brief-writing"],"type":"task_finished","data":{"result":"passed"}}
