{"schemaVersion":"1.0","eventId":"a1b2c3d4-0000-4000-8000-000000000028","time":"2026-11-02T09:28:00Z","sessionId":"7c9e6679-7425-40de-944b-e07fc1f90ae7","moduleId":"intro-chat","moduleVersion":"1.0.0","taskId":"write-brief","source":"app","skills":["brief-writing"],"type":"check_result","data":{"checkId":"c","attemptId":"attempt-1","status":"failed","durationMs":5,"evidence":"Line 4: expected (a, b) got 'c'; see x_y/z-1.","runnerType":"script"}}
